,300160,,,,,,Reviews,
18739638,german,2015.09.29 13:10,✅,✅,0.5307106972,6,"Nostalgie pur! Es ist zwar schon ein paar Jahre her das ich Bridge gespielt habe. Aber in der Zeit der Casual-Games (baue das an,ernte,verkaufe...) ist es eine willkommene Abwechslung. Der Anspruch steigt mit den Lvls und man muss auch man eine ganze Weile knobeln bis man eine Lösung findet. Aber da zeigt sich die alte dennoch gute Physikengine von  Terathon. 
Macht echt immer wieder Spaß!","Pure nostalgia! It's been a few years since I played bridge. But in these days of casual games (plant, harvest, sell...), it's a welcome change. The challenge increases with the level, and you have to puzzle for quite a while to find a solution. But that's where Terathon's old, yet still good, physics engine comes into its own.
It's always really fun!"
18737705,german,2015.09.29 08:27,✅,✅,0.4907407165,1,"Bridge ist zwar schon einige Jahre alt, es macht aber immer wieder Spaß es zu spielen. Die Missionen sind anfangs recht leicht, spätere Levels sind dann wirklich anspruchsvoll. Wenn man länger spielt kommen acuh immer mehr Nauteile hinzu, erst dann sieht man auch wie real die Physik umgesetzt worden ist. Vom Gameplay und der Grafik bin ich völlig zufrieden. Insgesamt ein sehr schönes Game was man auch mal zwischendurch spielen kann aber dennnoch den Ansprüchen einer echten Simulation erfüllt.","Bridge may be a few years old, but it's still fun to play. The missions start off fairly easy, but later levels become truly challenging. As you play for longer, more and more elements are added, and only then do you really appreciate how realistic the physics are. I'm completely satisfied with the gameplay and graphics. Overall, it's a very nice game that you can play now and again, but still meets the requirements of a true simulation."
18726405,english,2015.09.28 17:30,❌,✅,0.3339676559,26,I would not recomend this game caused of bad programmin and having such limited options when building bridges. i always liked to make funny looking but working bridges.. in this game it doesnt allow you to do enything funny.,I would not recomend this game caused of bad programmin and having such limited options when building bridges. i always liked to make funny looking but working bridges.. in this game it doesnt allow you to do enything funny.