,238870,,,,,,Reviews,
11811133,english,2014.07.22 00:17,❌,✅,0.5,1,"Citadels has potential but it isn't worthy it's current cost.  There are many older castle/siege games available on the market that are better in content and gameplay.  Citadels gameplay was okay.  My main complaints were the ackwardness of some building upgrades and the low population cap.  Considering the amount of population required to maintain your economy, a cap of 99 people was maddening when trying to manage an army.  At first I assumed the population limit would increase as the campaign progressed but before I knew it the campaign was over and the cap never changed.  I played a couple skirmish/sandbox games.  The castle defense one was boring on normal difficulty.  I then tried a duel map and found it more fun.  Both maps had ackward terrain to build on.  Steep terrain is a pain to build walls on.  It usually requires building towers close together.  However, if you build towers to close together, you may be prevented from building walls between them too.
Overall, the game wasn't very fun to play and recommend playing other games out there.","Citadels has potential but it isn't worthy it's current cost.  There are many older castle/siege games available on the market that are better in content and gameplay.  Citadels gameplay was okay.  My main complaints were the ackwardness of some building upgrades and the low population cap.  Considering the amount of population required to maintain your economy, a cap of 99 people was maddening when trying to manage an army.  At first I assumed the population limit would increase as the campaign progressed but before I knew it the campaign was over and the cap never changed.  I played a couple skirmish/sandbox games.  The castle defense one was boring on normal difficulty.  I then tried a duel map and found it more fun.  Both maps had ackward terrain to build on.  Steep terrain is a pain to build walls on.  It usually requires building towers close together.  However, if you build towers to close together, you may be prevented from building walls between them too.
Overall, the game wasn't very fun to play and recommend playing other games out there."
11809367,english,2014.07.21 21:43,❌,✅,0.5,1,"Well I chose to ignore everyones comments about this game and now I'm paying the price for that decision:(   I strongly recomend that the makers and or steam not sell this game to anyone else till they fix it completely or till the disc comes out!! Not only does it get glichy were the screen goes blue and lots of other crazy things! But it also freezes up on me every10 mins or so after you get to the 3rd level :(  It's at the point now that I can only play the frist two levels and it's getting BORING...

 Stop selling this game for money!   Reimburse everyone that has bot this game in the last few months since the last patch and move on!  If I buy another game and this happens to me again!  I will stop using steam to buy games and you'll loose that much more money!!","Well I chose to ignore everyones comments about this game and now I'm paying the price for that decision:(   I strongly recomend that the makers and or steam not sell this game to anyone else till they fix it completely or till the disc comes out!! Not only does it get glichy were the screen goes blue and lots of other crazy things! But it also freezes up on me every10 mins or so after you get to the 3rd level :(  It's at the point now that I can only play the frist two levels and it's getting BORING...

 Stop selling this game for money!   Reimburse everyone that has bot this game in the last few months since the last patch and move on!  If I buy another game and this happens to me again!  I will stop using steam to buy games and you'll loose that much more money!!"
11797251,english,2014.07.20 23:17,❌,✅,0.4045355618,0,"Seriously, I want to give this game 0, but I decided to give it one, because of the developers' skill of making quick money and then hiding in the shadow. I bought this game because I was so stupid, and because I am a big fan of stronghold games, and was hoping for any castle building RTS to replace Stronghold since the big disappointment of SH 3, but again SH 3 looks so perfect comparing to this garbage that they call it Citadels, its buggy, ugly, doesn't work, unoriginal, even things they copied it from other game they made it worse. Bunch of retards can make a better game than this, please avoid it at all cost, and if you already have it, please uninstall it and don't play cause it may gives you AIDS","Seriously, I want to give this game 0, but I decided to give it one, because of the developers' skill of making quick money and then hiding in the shadow. I bought this game because I was so stupid, and because I am a big fan of stronghold games, and was hoping for any castle building RTS to replace Stronghold since the big disappointment of SH 3, but again SH 3 looks so perfect comparing to this garbage that they call it Citadels, its buggy, ugly, doesn't work, unoriginal, even things they copied it from other game they made it worse. Bunch of retards can make a better game than this, please avoid it at all cost, and if you already have it, please uninstall it and don't play cause it may gives you AIDS"
11788101,english,2014.07.20 05:59,❌,✅,0.5,1,"as much as I want this game to be awesome, it is held back by numerous crashes and other bugs. Thankfully I got this during a steam sale so I didn't wasted $40 like most people here.","as much as I want this game to be awesome, it is held back by numerous crashes and other bugs. Thankfully I got this during a steam sale so I didn't wasted $40 like most people here."
11783981,french,2014.07.19 23:08,❌,✅,0.5,0,"que dire a part qu'il ne casse pas trois pattes à un canard
39 euro trop cher pour ce qu'il vaut!!!!!","What can I say except that it's not worth anything.
39 euros is too expensive for what it's worth!!!!!"
11731510,english,2014.07.16 03:27,❌,✅,0.5,1,"I got this on sale despite the reviews... ugh, BELIEVE THE REVIEWS.... sooo much promise, sooo much fail!!!","I got this on sale despite the reviews... ugh, BELIEVE THE REVIEWS.... sooo much promise, sooo much fail!!!"
11593263,french,2014.07.08 01:25,❌,✅,0.7628487945,27,"NOnnnnnnn... : C'est un tres bon jeu ! Tres facile de prise en main !

MAIS   NON, MAIS   NON : DES BUGS (tres important) + des gros problemes de ""running time"" = Plante SANS ARRET.
Bloquer a la 3 eme mission impossible d'aller plus loin (et pourtant j'ai percevere) ... !

Pffff, ne pas acheter, c'est dommage.","NOooo... It's a very good game! Very easy to pick up!

BUT NO, BUT NO: BUGS (very significant) + major running time issues = Crashes CONSTANTLY.
Stuck on the third mission, impossible to go any further (and yet I persevered)...!

Pffff, don't buy it, it's a shame."
11588108,french,2014.07.07 17:46,❌,✅,0.657261312,18,"franchement le jeux avais un bon potentiels mais tout c'est bug ruines le jeux les graphiques sons pas térrible
et il a pas de fun.

je recommende vraiment pas le jeux.

Je vous conseille de pas l'acheter","Honestly, the game had good potential, but all the bugs ruined the game, the graphics, the sound, and it's not great, and it's not fun.

I really don't recommend the game.

I advise you not to buy it."
11543832,english,2014.07.04 09:56,❌,❌,0.6670918465,48,I would love to have my money back on this games as it is unplayable. It locks up both of the computers I own. The lack of an autosave feature in a game with this many issues is appaling.,I would love to have my money back on this games as it is unplayable. It locks up both of the computers I own. The lack of an autosave feature in a game with this many issues is appaling.
11515668,english,2014.07.02 08:09,❌,✅,0.6156639457,19,"After trying to play this game quite a few times. I got up to the 3rd level. And it kept freezing. The AI of your units is so bad that they all seem to find the dumbest way of doing things. Then run straight at the enemy castle and get killed.

The ability to select what you want by clicking on it normally gets something near by and not what you want. Drives you insane.

I would not even buy this on sale. I can not recommend this to anyone. Well maybe if they fix the bugs I could. But will see.","After trying to play this game quite a few times. I got up to the 3rd level. And it kept freezing. The AI of your units is so bad that they all seem to find the dumbest way of doing things. Then run straight at the enemy castle and get killed.

The ability to select what you want by clicking on it normally gets something near by and not what you want. Drives you insane.

I would not even buy this on sale. I can not recommend this to anyone. Well maybe if they fix the bugs I could. But will see."
11456699,english,2014.06.29 03:31,❌,✅,0.5217391253,1,Don't even think about it,Don't even think about it
11419713,german,2014.06.26 18:40,❌,✅,0.5,0,"NICHT KAUFEN!!!!
Wartet lieber bis Stronghold II Crusader raus ist!

- Grafikfehler am laufenden Band
- Unschöne Details (Trompetengetöse einer Reiterei im amerikanischen Bürgerkrieg WTF!!, Flaggen die wie Würste in der Luft hängen, ohne sich zu bewegen etc.)
- häufige Abstürze
- extrem schlechte Umsetzung der Einheiten KI. (soweit überhaupt vorhanden)

ICH WILL MEIN GELD ZURÜCK!!!","DO NOT BUY!!!!
Better wait until Stronghold II Crusader is released!

- Graphical glitches galore
- Unpleasant details (the trumpet blare of a cavalry in the American Civil War, WTF!!, flags hanging in the air like sausages without moving, etc.)
- Frequent crashes
- Extremely poor implementation of the unit AI (to the extent that it exists at all)

I WANT MY MONEY BACK!!!"
11404384,english,2014.06.25 18:08,❌,✅,0.6520802379,11,"Absolutely terrible game.

good points:
----------------

bad points:
-terrible AI
- extremly bad graphics (screenshots look like a completely different game)
-buggy as all hell, half of the game mechanics are glitched or don't work at all
-unstable framerate (intel I7, 16gb ram, gtx 860m) 
-majorly overpriced, worth 5 at max.

and the list goes on.","Absolutely terrible game.

good points:
----------------

bad points:
-terrible AI
- extremly bad graphics (screenshots look like a completely different game)
-buggy as all hell, half of the game mechanics are glitched or don't work at all
-unstable framerate (intel I7, 16gb ram, gtx 860m) 
-majorly overpriced, worth 5 at max.

and the list goes on."
11383116,spanish,2014.06.24 03:34,✅,✅,0.3525640965,0,el juego esta muy bueno y me encanta el unico detalle es que no recomiendo conprarlo pol steam  tendran muchos poblemas de programasion que son culpa de stem ami luego de jugar pol 30 minutos el juego se siera pol un poblema de app crash  y en todo lo que e buscado  y borado mi pc varias beses no lo puedo solucional y en internet aparese como un errol de steam  recomiendo lo compren pol amazon aun que salga igual o mas carro evitesen poblemas con steam ellos no responden nunca,"The game is very good and I love it, the only detail is that I do not recommend buying it through Steam. They will have many programming problems that are STEM's fault. After playing for 30 minutes, the game crashed due to an app crash problem and in everything I have searched and deleted my PC several times, I cannot solve it and on the Internet it appears as a Steam error. I recommend buying it through Amazon even if it comes out the same or cheaper, avoid problems with Steam, they never respond."
11369191,english,2014.06.23 05:16,❌,✅,0.5138120651,6,Do not waste your money,Do not waste your money
11366967,english,2014.06.23 01:35,❌,❌,0.5008460283,5,"Very poorly made game, so many bugs and glitches.  Age of Empires got you beat.","Very poorly made game, so many bugs and glitches.  Age of Empires got you beat."
11362086,german,2014.06.22 19:31,❌,✅,0.5,0,Ich kann dieses Spiel nicht spielen. Jedes mal beim Starten kommt die Fehlermeldung: citadels.exe funktioniert nicht mehr. Auch erneute Installation und Grafikkartentreiber-Update brachten keinen Erfolg,"I can't play this game. Every time I launch it, I get the error message: citadels.exe has stopped working. Reinstalling and updating the graphics card driver didn't help either."
11314037,english,2014.06.19 10:24,❌,✅,0.5586721897,13,"This game looks so great in screenshots, but is such a let-down to play :(

I, of course, ignored all the negative reviews because it just looked so purty. Huge mistake. This game is not worth the cost of entry.","This game looks so great in screenshots, but is such a let-down to play :(

I, of course, ignored all the negative reviews because it just looked so purty. Huge mistake. This game is not worth the cost of entry."
11310070,english,2014.06.19 02:52,❌,✅,0.8780843616,167,"This game is terrible. The videos and screenshots are deceptive, making the game appear to be of a higher quality than it actually is. The graphics are low quality, the UI is badly programmed, and there is no tutorial, making it difficult to learn how to play. $40 is incredibly overpriced for this.","This game is terrible. The videos and screenshots are deceptive, making the game appear to be of a higher quality than it actually is. The graphics are low quality, the UI is badly programmed, and there is no tutorial, making it difficult to learn how to play. $40 is incredibly overpriced for this."
11307658,english,2014.06.18 23:22,❌,✅,0.5161011815,8,Not worth $40!! Wasnt when it came out either!!,Not worth $40!! Wasnt when it came out either!!
11294748,russian,2014.06.18 02:03,❌,✅,0.7442749739,39,На скринах игра збс. А так купил прям как-будто на голову насрали.,The screenshots show the game as awesome. But I bought it and it felt like someone had shit on my head.
11236216,english,2014.06.14 23:37,❌,✅,0.520958066,1,"All i can say is that i want a refund
20/10 IGN","All i can say is that i want a refund
20/10 IGN"
11201317,french,2014.06.12 19:50,❌,✅,0.6751832962,16,"Des bugs un peu partout, au niveau des murailles, au niveau des villageois, au niveau des batiments, 1 an après sa sortie et tout un paquet de patch, ce jeu est toujours injouable.

Et même si on fait l'impasse sur les bugs (ce qui est difficile vu leurs fréquence...), ce jeu et tout juste du niveau d'Age Of Empire II qui lui est sorti en 1999 !!

Comment un studio peut-il dévellopper une aussi grosse MERDE ?!?

N'ACHETEZ PAS !!!","Bugs everywhere, in the walls, in the villagers, in the buildings. A year after its release and a whole bunch of patches, this game is still unplayable.

And even if we ignore the bugs (which is difficult given their frequency...), this game is barely on par with Age of Empires II, which was released in 1999!!

How can a studio develop such a piece of SHIT?!?

DON'T BUY!!!"
11174155,english,2014.06.11 03:05,❌,✅,0.4856737852,5,It is realy realy realy bad,It is realy realy realy bad
11168362,brazilian,2014.06.10 20:17,❌,❌,0.4131910801,4,Não da para jogar On-Line....,You can't play online...
11085310,french,2014.06.05 18:37,❌,✅,0.5,0,"Achetez Stronghold HD, moins cher et largement mieux!!!!

Trop de bugs avec Citadels, n'attendez pas de faire des châteaux commen dans la vidéo, c'est mort...( ah mince, y'a un buisson qui m'enpêche de faire ma muraille, zut...-_-' )
Achat très très décevant, heureusement que je connaissais stronghold la comparaison fût immédiate: je suis retourné sur stronghold!

Dommage ça s'annoncait pourtant bien.","Buy Stronghold HD, cheaper and much better!!!!

Too many bugs with Citadels, don't wait to build castles like in the video, it's dead... (oh damn, there's a bush stopping me from building my wall, damn... -_-' )
Very, very disappointing purchase, luckily I knew Stronghold, the comparison was immediate: I went back to Stronghold!

Too bad, it was looking good."
11076596,english,2014.06.05 04:03,✅,✅,0.3710766435,2,"Have just completed first mission, no glitches, crashes or problems of any kind. Excellant game","Have just completed first mission, no glitches, crashes or problems of any kind. Excellant game"
11061785,english,2014.06.04 08:01,✅,✅,0.4434281886,5,I love that game but It keep freezing. Even with my bomb computer and the best net on the planet! This is too bad!!!,I love that game but It keep freezing. Even with my bomb computer and the best net on the planet! This is too bad!!!
10983655,english,2014.05.30 23:55,❌,✅,0.4748201668,1,Fuck this. I want my money back.,Fuck this. I want my money back.
10983223,english,2014.05.30 23:38,❌,✅,0.4785714149,1,Don't.,Don't.
10951026,swedish,2014.05.29 23:35,❌,✅,0.5,2,"KÖP INTE SPELET!! DET BUGGADE OCH NU KAN JAG INTE ENS STARTA DET! SJUKT DÅLIGT! 
-DO NOT BUY THE GAME! THE BUGS AND NOW I CAN NOT EVEN START IT! SICK BAD!-",
10938001,french,2014.05.29 15:54,❌,✅,0.5177664757,2,"C'est vraiment nul :p
Une sorte de Age of empire sans saveur ni originalité.

Il y a encore des bugs (par exemple je ne peux pas construire de militaires car dès que j'ai de la place au niveau de la pop, des paysans se construisent automatiquement... et je n'ai plus de place pour un soldat... en envoyant les paysans au massacre pareil, ils se reproduiseent avant les militaires).

","It's really bad :p
A kind of Age of Empires without flavor or originality.

There are still bugs (for example, I can't build soldiers because as soon as I have space in terms of population, peasants are automatically built... and I don't have room for a soldier anymore... by sending the peasants to the massacre, they reproduce before the soldiers).

"
10936785,german,2014.05.29 15:04,❌,✅,0.5,0,"""Eigentlich ein gut gedachtes Spiel. Leider ist die Umsetzung Stand Heute (2014-06-29) grauenvoll. Es hagelt Bugs (Einheiten können nur ausgewählt werden, wenn die Kamera direkt darüber ist; Mauer verschinden im Bau). Beschriftung vieler Buttons fehlen oder sind fehlerhaft ODER sind ohne Sinnesgehalt.

Ich habe das Spiel zum Start schon einmal bei einem Freund getestet, gefühlt fand keinerlei Bugfixing statt!!!
- Absolute Frechheit.

Zum jetzigen Zeitpunkt nicht einmal 5 € Wert, denn es stürzt auch noch ohne Ankündigung ab!""

UPDATE:...die Instabilität scheint nur im Skirmish zu sein?! Habe nun eine Mission angefangen und hatte bisher keine Abstürze.","""Actually a well-intentioned game. Unfortunately, the implementation as of today (2014-06-29) is awful. It's riddled with bugs (units can only be selected when the camera is directly over them; walls disappear during construction). Many button labels are missing, incorrect, or meaningless.

I tested the game at a friend's house when it launched, and it seemed like no bug fixing was done!!!
- Absolutely outrageous.

Not even worth €5 at this point, because it crashes without warning!""

UPDATE:...the instability seems to only be in skirmish?! I've now started a mission and haven't had any crashes so far."
10868702,russian,2014.05.27 16:34,✅,✅,0.3758691847,0,хунта,junta
10866529,english,2014.05.27 15:02,❌,✅,0.4420549572,0,DO NOT BUY THIS GAME!!!!!!!!!!!!!!!!!!!!!!!!!!!!!!!!!!!!!!!!!!!!!!!!!!!!!!!!!!!!!!!!!!!!!!!!!!!!!!!!!!!!!!!!!!!!!!!!!!!! YOU DON'T NEED TO KNOW WHY BECAUSE THE LIST IS TOO LONG!!!!!!!!!!!!!!!!!!!!!!!!!!!!!!!!!!!!!!!!!!!!!!!!!!!!!!!!!!!!!!!,DO NOT BUY THIS GAME!!!!!!!!!!!!!!!!!!!!!!!!!!!!!!!!!!!!!!!!!!!!!!!!!!!!!!!!!!!!!!!!!!!!!!!!!!!!!!!!!!!!!!!!!!!!!!!!!!!! YOU DON'T NEED TO KNOW WHY BECAUSE THE LIST IS TOO LONG!!!!!!!!!!!!!!!!!!!!!!!!!!!!!!!!!!!!!!!!!!!!!!!!!!!!!!!!!!!!!!!
10785772,english,2014.05.25 11:35,❌,✅,0.4736842215,0,Weird 2-cursor thing going on makes it difficult to select things or give commands,Weird 2-cursor thing going on makes it difficult to select things or give commands
10783939,english,2014.05.25 09:57,❌,✅,0.4803149402,2,"Total waste of money, even on sale! Save yourself!","Total waste of money, even on sale! Save yourself!"
10780319,english,2014.05.25 07:07,✅,✅,0.3627569079,2,Build your own castles. What more can I say?,Build your own castles. What more can I say?
10765462,english,2014.05.24 22:50,❌,✅,0.6770442724,37,"I kept coming back to this game hoping it would be improved. It had such potential. Unfortunately, every single bug remains from when I first bought it when it first became avaialble to now. Peasants will suddenly bug out and stop what they should be doing, buildings will be halted in mid-construction with no way of demolishing them or completing them, and various other issues crop up on a regular basis with no workarounds that I could find. 

Do yourself a favor and save your money.","I kept coming back to this game hoping it would be improved. It had such potential. Unfortunately, every single bug remains from when I first bought it when it first became avaialble to now. Peasants will suddenly bug out and stop what they should be doing, buildings will be halted in mid-construction with no way of demolishing them or completing them, and various other issues crop up on a regular basis with no workarounds that I could find. 

Do yourself a favor and save your money."
10607069,french,2014.05.21 14:16,❌,✅,0.5,0,Le jeu plante régulièrement pendant les attaques surtout à partir de la quatrième carte de la campagne. Et pas de correction en vue. Dommage.,"The game crashes regularly during attacks, especially from the fourth map of the campaign onwards. And there's no fix in sight. Too bad."
10563909,french,2014.05.20 16:50,❌,✅,0.5,0,not worth the price !!!!! not worth buying it !!!!,not worth the price!!!!! not worth buying it!!!!
10522739,english,2014.05.19 10:55,✅,✅,0.308190614,2,Very Very Very Boring. Nothing like AOE.,Very Very Very Boring. Nothing like AOE.
10518708,french,2014.05.19 01:10,❌,✅,0.5,0,"Le pire Achat fait sur steam de ma part de tout les temps, gameplay mauvais et des bugs à volonté.","Worst Steam purchase I've ever made, bad gameplay and bugs galore."
10506939,french,2014.05.17 23:23,❌,✅,0.5,0,"IA a chier, jeu sans aucun interet.. 6 sur 20","Shitty AI, completely pointless game... 6 out of 20"
10500470,english,2014.05.17 09:41,❌,❌,0.5,2,"I've played Civ, AoE, Starcraft, Rise of Nations, etc. and I simply cannot recommend this game. It is EXTREMELY buggy, certain units move when they want to or not at all, some things work, some don't. ""Citadels"" has several of the basic aspects of an RTS and nothing more. $5 dollars is the most I'd pay for this game and nothing more.","I've played Civ, AoE, Starcraft, Rise of Nations, etc. and I simply cannot recommend this game. It is EXTREMELY buggy, certain units move when they want to or not at all, some things work, some don't. ""Citadels"" has several of the basic aspects of an RTS and nothing more. $5 dollars is the most I'd pay for this game and nothing more."
10431921,english,2014.05.12 00:45,❌,✅,0.4862604439,1,Rubbish.,Rubbish.
10289218,russian,2014.04.30 22:36,❌,✅,0.5,0,Отвратительнейшая и страшно глючная поделка. Просто мусор не стоящий ни рубля.,"A disgusting and terribly buggy piece of work. Simply garbage, not worth a ruble."
10267789,english,2014.04.29 00:24,❌,✅,0.5,1,....not worth 39.99,....not worth 39.99
10265868,english,2014.04.28 21:20,❌,✅,0.5,1,Just play Age of Empires.  This is a mediocre rip off.,Just play Age of Empires.  This is a mediocre rip off.
10174236,english,2014.04.20 03:25,❌,✅,0.5744201541,7,"DO NOT BUY
0/10

To make the review short, you might as well buy Stronghold or Age of Empire. 

For a strategy game it's just way too simple in my opinion. Building and Unit choice is very limited and you can experience everything in 3 missions. It brings nothing new to the genre and it's not improving on anything.","DO NOT BUY
0/10

To make the review short, you might as well buy Stronghold or Age of Empire. 

For a strategy game it's just way too simple in my opinion. Building and Unit choice is very limited and you can experience everything in 3 missions. It brings nothing new to the genre and it's not improving on anything."
10133379,english,2014.04.16 04:54,❌,✅,0.524576962,2,This game is frustrating. It keeps locking up in the middle of playing. I will be an hour into the mission and it will randomly freeze and I will loose my progress.,This game is frustrating. It keeps locking up in the middle of playing. I will be an hour into the mission and it will randomly freeze and I will loose my progress.
10117377,danish,2014.04.15 14:21,✅,✅,0.5,0,"2cb ram?
",
10087930,english,2014.04.12 02:32,❌,✅,0.5,1,"I really wanted to like this game, and I feel it has potential. But in its current state, the game is unplayable.","I really wanted to like this game, and I feel it has potential. But in its current state, the game is unplayable."
10086530,english,2014.04.11 23:43,❌,✅,0.4736842215,0,A game as bland and boring as its title. Nothing unique or interesting about this one.,A game as bland and boring as its title. Nothing unique or interesting about this one.
10084791,english,2014.04.11 20:33,✅,✅,0.3446865976,2,do no buy this game it might seem to be good but its not. This game is not worth the large amount of money it costs. (they have increased the price just so you know).,do no buy this game it might seem to be good but its not. This game is not worth the large amount of money it costs. (they have increased the price just so you know).
